{
  "$schema": "./schemas/acceptance.schema.json",
  "formatVersion": 1,
  "note": "Stage 9 (docs/RESTORE.md, C-46). Kept by hand. Each auto row is one safe call: read-only, or a search, page read or short speech with no effect outside the stack. Rows with a real-world effect are user rows. Stage 9 also checks that every tool, function and enabled tool server in the OWUI seed is covered, and adds one row per model preset from 'models'.",
  "groups": {
    "1": "Local inference",
    "2": "Cloud providers",
    "3": "MCP and OpenAPI tool servers",
    "4": "Web search",
    "5": "Page reading",
    "6": "Image and video",
    "7": "Speech to text",
    "8": "Text to speech",
    "9": "Notifications",
    "10": "Gmail",
    "11": "Filters",
    "12": "Bolt and open-terminal from the VPS",
    "13": "Model presets and skills",
    "14": "Other tools",
    "15": "Dashboard and Dozzle"
  },
  "rows": [
    {
      "id": "ollama-models",
      "group": 1,
      "who": "auto",
      "owner": 6,
      "what": "Ollama lists its models",
      "probe": {
        "type": "http",
        "url": "http://127.0.0.1:11434/api/tags",
        "contains": "\"models\""
      }
    },
    {
      "id": "local-chat",
      "group": 1,
      "who": "user",
      "owner": 3,
      "what": "A local model answers in OWUI",
      "steps": "In OWUI on this PC, start a new chat with a local Ollama model and ask a short question. It answers, and 'ollama ps' shows the model at 100% GPU."
    },
    {
      "id": "cloud-chat",
      "group": 2,
      "who": "user",
      "owner": 7,
      "what": "OpenAI, Anthropic and Cline each answer",
      "steps": "In OWUI, send one short message through each cloud connection: an OpenAI model, an Anthropic model and a Cline model from the model menu. Each answers."
    },
    {
      "id": "server:browser",
      "group": 3,
      "who": "auto",
      "owner": 8,
      "what": "mcpo browser: browser_tabs answers",
      "server": "/browser/?$",
      "probe": {
        "type": "mcpo",
        "server": "browser",
        "operation": "browser_tabs",
        "body": {
          "action": "list"
        },
        "contains": "Result",
        "timeoutSec": 90
      }
    },
    {
      "id": "server:censys",
      "group": 3,
      "who": "auto",
      "owner": 8,
      "what": "mcpo censys: lists its tools (not called: no tool of it is known to be free and read-only)",
      "server": "/censys/?$",
      "probe": {
        "type": "mcpo",
        "server": "censys"
      }
    },
    {
      "id": "server:companies_house",
      "group": 3,
      "who": "auto",
      "owner": 8,
      "what": "mcpo companies_house: search_companies answers",
      "server": "/companies_house/?$",
      "probe": {
        "type": "mcpo",
        "server": "companies_house",
        "operation": "search_companies",
        "body": {
          "query": "The Open University"
        },
        "contains": "### Company search"
      }
    },
    {
      "id": "server:context7",
      "group": 3,
      "who": "auto",
      "owner": 8,
      "what": "mcpo context7: resolve-library-id answers",
      "server": "/context7/?$",
      "probe": {
        "type": "mcpo",
        "server": "context7",
        "operation": "resolve-library-id",
        "body": {
          "query": "React hooks",
          "libraryName": "React"
        },
        "contains": "Available Libraries",
        "timeoutSec": 90
      }
    },
    {
      "id": "server:filesystem",
      "group": 3,
      "who": "auto",
      "owner": 8,
      "what": "mcpo filesystem: list_allowed_directories answers",
      "server": "/filesystem/?$",
      "probe": {
        "type": "mcpo",
        "server": "filesystem",
        "operation": "list_allowed_directories",
        "body": {},
        "contains": "Allowed directories"
      }
    },
    {
      "id": "server:github",
      "group": 3,
      "who": "auto",
      "owner": 8,
      "what": "mcpo github: lists its tools (not called: no tool of it is known to be free and read-only)",
      "server": "/github/?$",
      "probe": {
        "type": "mcpo",
        "server": "github"
      }
    },
    {
      "id": "server:gmail-bridge",
      "group": 3,
      "who": "auto",
      "owner": 8,
      "what": "the Gmail bridge serves its OpenAPI description",
      "server": ":18101(/|$)",
      "probe": {
        "type": "http",
        "url": "http://127.0.0.1:18101/openapi.json",
        "contains": "/profile"
      }
    },
    {
      "id": "server:jina_reader",
      "group": 3,
      "who": "auto",
      "owner": 8,
      "what": "mcpo jina_reader: read_url answers",
      "server": "/jina_reader/?$",
      "probe": {
        "type": "mcpo",
        "server": "jina_reader",
        "operation": "read_url",
        "body": {
          "url": "https://example.com"
        },
        "contains": "Example Domain",
        "timeoutSec": 90
      }
    },
    {
      "id": "server:mcp_risk_scanner",
      "group": 3,
      "who": "auto",
      "owner": 8,
      "what": "mcpo mcp_risk_scanner: explain_risk_model answers",
      "server": "/mcp_risk_scanner/?$",
      "probe": {
        "type": "mcpo",
        "server": "mcp_risk_scanner",
        "operation": "explain_risk_model",
        "body": {}
      }
    },
    {
      "id": "server:memory",
      "group": 3,
      "who": "auto",
      "owner": 8,
      "what": "mcpo memory: read_graph answers",
      "server": "/memory/?$",
      "probe": {
        "type": "mcpo",
        "server": "memory",
        "operation": "read_graph",
        "body": {},
        "contains": "entities"
      }
    },
    {
      "id": "server:mitre_attack",
      "group": 3,
      "who": "auto",
      "owner": 8,
      "what": "mcpo mitre_attack: get_technique_by_id answers",
      "server": "/mitre_attack/?$",
      "probe": {
        "type": "mcpo",
        "server": "mitre_attack",
        "operation": "get_technique_by_id",
        "body": {
          "technique_id": "T1055"
        },
        "contains": "Process Injection",
        "timeoutSec": 90
      }
    },
    {
      "id": "server:open-terminal",
      "group": 3,
      "who": "auto",
      "owner": 8,
      "what": "open-terminal answers its key: GET /files/cwd",
      "server": ":18019(/|$)",
      "probe": {
        "type": "http",
        "url": "http://127.0.0.1:18019/files/cwd",
        "uses": "terminal",
        "contains": "cwd"
      }
    },
    {
      "id": "server:osint",
      "group": 3,
      "who": "auto",
      "owner": 8,
      "what": "mcpo osint: osint_list_sources answers",
      "server": "/osint/?$",
      "probe": {
        "type": "mcpo",
        "server": "osint",
        "operation": "osint_list_sources",
        "body": {},
        "contains": "HackerTarget"
      }
    },
    {
      "id": "server:security_tools",
      "group": 3,
      "who": "auto",
      "owner": 8,
      "what": "mcpo security_tools: lists its tools (not called: no tool of it is known to be free and read-only)",
      "server": "/security_tools/?$",
      "probe": {
        "type": "mcpo",
        "server": "security_tools"
      }
    },
    {
      "id": "server:semgrep",
      "group": 3,
      "who": "auto",
      "owner": 8,
      "what": "mcpo semgrep: get_supported_languages answers",
      "server": "/semgrep/?$",
      "probe": {
        "type": "mcpo",
        "server": "semgrep",
        "operation": "get_supported_languages",
        "body": {},
        "contains": "python"
      }
    },
    {
      "id": "server:sequential_thinking",
      "group": 3,
      "who": "auto",
      "owner": 8,
      "what": "mcpo sequential_thinking: sequentialthinking answers",
      "server": "/sequential_thinking/?$",
      "probe": {
        "type": "mcpo",
        "server": "sequential_thinking",
        "operation": "sequentialthinking",
        "body": {
          "thought": "Stage 9 acceptance",
          "nextThoughtNeeded": false,
          "thoughtNumber": 1,
          "totalThoughts": 1
        },
        "contains": "thoughtHistoryLength"
      }
    },
    {
      "id": "server:shodan",
      "group": 3,
      "who": "auto",
      "owner": 8,
      "what": "mcpo shodan: dns_lookup answers",
      "server": "/shodan/?$",
      "probe": {
        "type": "mcpo",
        "server": "shodan",
        "operation": "dns_lookup",
        "body": {
          "hostnames": [
            "example.com"
          ]
        },
        "contains": "DNS Resolutions"
      }
    },
    {
      "id": "server:time",
      "group": 3,
      "who": "auto",
      "owner": 8,
      "what": "mcpo time: get_current_time answers",
      "server": "/time/?$",
      "probe": {
        "type": "mcpo",
        "server": "time",
        "operation": "get_current_time",
        "body": {
          "timezone": "Europe/London"
        },
        "contains": "day_of_week"
      }
    },
    {
      "id": "server:web_fetch",
      "group": 3,
      "who": "auto",
      "owner": 8,
      "what": "mcpo web_fetch: fetch answers",
      "server": "/web_fetch/?$",
      "probe": {
        "type": "mcpo",
        "server": "web_fetch",
        "operation": "fetch",
        "body": {
          "url": "https://example.com",
          "max_length": 500
        },
        "contains": "Contents of https://example.com",
        "timeoutSec": 90
      }
    },
    {
      "id": "server:web_search",
      "group": 3,
      "who": "auto",
      "owner": 8,
      "what": "mcpo web_search: searxng_web_search answers",
      "server": "/web_search/?$",
      "probe": {
        "type": "mcpo",
        "server": "web_search",
        "operation": "searxng_web_search",
        "body": {
          "query": "open webui"
        },
        "timeoutSec": 90
      }
    },
    {
      "id": "server:youtube_transcript",
      "group": 3,
      "who": "auto",
      "owner": 8,
      "what": "mcpo youtube_transcript: get_available_languages answers",